,Title,Link,cor_A,inst,Author,vol_num,paper_type,Journal
474,Diagnostic performance of CellaVision DM96 for Plasmodium vivax and Plasmodium falciparum screening in peripheral blood smears,https://www.scopus.com/authid/detail.uri?authorId=15925343600&amp,Lim C.S.,Elsevier B.V.,"Yoon Jung, Kwon Jung-ah, Yoon Sooyung Young, Jang Woongsik, Yang Dong-june, Nam Jeonghun Hoon, Lim Chaeseung",7-11,Article,Acta Tropica
475,Continuous erythrocyte removal and leukocyte separation from whole blood based on viscoelastic cell focusing and the margination phenomenon,https://www.scopus.com/authid/detail.uri?authorId=15925343600&amp,Nam J.,Elsevier B.V.,"Nam Jeonghun Hoon, Yoon Jung, Kim Jeeyong, Jang Woongsik, Lim Chaeseung",230-239,Article,Journal of Chromatography A
476,0,0,0,0,0,0,0,
477,Sheathless high-throughput circulating tumor cell separation using viscoelastic non-Newtonian fluid,https://www.scopus.com/authid/detail.uri?authorId=12773261000&amp,Choi H.,MDPI AG,"Lim Hyunjung, Back Seung-min, Hwang Min-ho, Lee Dae-hee, Choi Hyuk, Nam Jeonghun Hoon",462,Article,MicromachinesOpen Access
478,Performance evaluation of three rapid antigen tests for the diagnosis of group A Streptococci,https://www.scopus.com/authid/detail.uri?authorId=15925343600&amp,Lim C.S.,BMJ Publishing Group,"Kim Ha-nui, Kim Jeeyong, Jang Woongsik, Nam Jeonghun Hoon, Lim Chaeseung",e025438,Article,BMJ OpenOpen Access
479,Lamb wave-based molecular diagnosis using DNA hydrogel formation by rolling circle amplification (RCA) process,https://www.scopus.com/authid/detail.uri?authorId=15925343600&amp,Nam J.,Elsevier Ltd,"Nam Jeonghun Hoon, Jang Woongsik, Kim Jisu, Lee Hyukjin, Lim Chaeseung",111496,Article,Biosensors and Bioelectronics
480,Sheathless shape-based separation of candida albicans using a viscoelastic non-newtonian fluid,https://www.scopus.com/authid/detail.uri?authorId=15925343600&amp,Nam J.,MDPI AG,"Nam Jeonghun Hoon, Jee Hyunseul, Jang Woongsik, Yoon Jung, Park Borae G., Lee Seongjae, Lim Chaeseung",817,Article,MicromachinesOpen Access
481,Acoustic mixing in a dome-shaped chamber-based SAW (DC-SAW) device,https://www.scopus.com/authid/detail.uri?authorId=12773261000&amp,Choi H.,Royal Society of Chemistry,"Lim Hyunjung, Back Seung-min, Choi Hyuk, Nam Jeonghun Hoon",120-125,Article,Lab on a Chip
482,Specific visible radiation facilitates lipolysis in mature 3T3-L1 adipocytes via rhodopsin-dependent β3-adrenergic signaling,https://www.scopus.com/authid/detail.uri?authorId=36058502000&amp,Cho E.-G.,Elsevier GmbH,"Park Phil-june, Cho Jaeyoul, Cho Eungyung",301-311,Article,European Journal of Cell Biology
483,Topical delivery of coenzyme Q10-loaded microemulsion for skin regeneration,https://www.scopus.com/authid/detail.uri?authorId=57203772993&amp,Jang D.-J.,MDPI AG,"Ryu Kyeong A., Park Phil-june, Kim Seong-bo, Bin Bumho, Jang Dong-jin, Kim Sungtae",332,Article,PharmaceuticsOpen Access
484,Kojyl cinnamate ester derivatives increase adiponectin expression and stimulate adiponectin-induced hair growth factors in human dermal papilla cells,https://www.scopus.com/authid/detail.uri?authorId=36058502000&amp,Cho E.-G.,MDPI AG,"Park Phil-june, Cho Eungyung",1859,Article,International Journal of Molecular SciencesOpen Access
485,Theaflavin-enriched fraction stimulates adipogenesis in human subcutaneous fat cells,https://www.scopus.com/authid/detail.uri?authorId=57203772993&amp,Park P.J.,MDPI AG,"Park Phil-june, Rha Chan Su, Kim Sungtae",2034,Article,International Journal of Molecular SciencesOpen Access
486,PPARγ-mediated G-protein coupled receptor 120 signaling pathway promotes transcriptional activation of miR-143 in adipocytes,https://www.scopus.com/authid/detail.uri?authorId=36066105900&amp,Lee T.R.,Elsevier B.V.,"Bae In-seon, Park Phil-june, Lee Jeonghwa, Cho Eungyung, Lee Tae-ryong, Kim Sang Hoon",64-69,Article,Gene
487,Nanoformulation-based sequential combination cancer therapy,https://www.scopus.com/authid/detail.uri?authorId=7402125977&amp,Oh Y.-K.,Elsevier B.V.,"Shim Gayong, Kim Mi-gyeong, Kim Dongyoon, Park Jooyeon, Oh Yukyoung",57-81,Review,Advanced Drug Delivery Reviews
488,Bacteriomimetic poly-γ-glutamic acid surface coating for hemocompatibility and safety of nanomaterials,https://www.scopus.com/authid/detail.uri?authorId=7402125977&amp,Shim G.,Taylor and Francis Ltd,"Shim Gayong, Kim Dongyoon, Kim Jinyoung, Suh Min-sung, Kim Youn-kyu, Oh Yukyoung",762-770,Article,Nanotoxicology
489,Light-switchable systems for remotely controlled drug delivery,https://www.scopus.com/authid/detail.uri?authorId=7402125977&amp,Oh Y.-K.,Elsevier B.V.,"Shim Gayong, Ko Seungbeom, Kim Dongyoon, Le Quocviet, Park Gyu-thae, Lee Jaiwoo, Kwon Taekhyun, Choi Hangon, Kim Young-bong, Oh Yukyoung",67-79,Article,Journal of Controlled Release
490,Chemokine-mimetic plerixafor derivative for tumor-specific delivery of nanomaterials,https://www.scopus.com/authid/detail.uri?authorId=7402125977&amp,Oh Y.-K.,Tsinghua University Press,"Ko Seungbeom, Shim Gayong, Kim Jinyoung, Oh Yukyoung",2159-2172,Article,Nano Research
491,Stemmed DNA nanostructure for the selective delivery of therapeutics,https://www.scopus.com/authid/detail.uri?authorId=7402125977&amp,Shim G.,Royal Society of Chemistry,"Jin Hyerim, Kim Mi-gyeong, Ko Seungbeom, Kim Dohee, Lee Bong Jin, MacGregor Robert B., Shim Gayong, Oh Yukyoung",7511-7518,Article,Nanoscale
492,Staphylococcus aureus-mimetic control of antibody orientation on nanoparticles,https://www.scopus.com/authid/detail.uri?authorId=7402125977&amp,Oh Y.-K.,Elsevier Inc.,"Shim Gayong, Kim Dongyoon, Lee Sangbin, Chang Raesung, Byun Junho, Oh Yukyoung",267-277,Article,"Nanomedicine: Nanotechnology, Biology, and Medicine"
493,Sequential activation of anticancer therapy triggered by tumor microenvironment-selective imaging,https://www.scopus.com/authid/detail.uri?authorId=7402125977&amp,Oh Y.-K.,Elsevier B.V.,"Shim Gayong, Le Quocviet, Suh Juhan, Choi Sunhee, Kim Gunwoo, Choi Hangon, Kim Young-bong, MacGregor Robert B., Oh Yukyoung",110-119,Article,Journal of Controlled Release
494,In Situ Nanoadjuvant-Assembled Tumor Vaccine for Preventing Long-Term Recurrence,https://www.scopus.com/authid/detail.uri?authorId=7402125977&amp,Shim G.,American Chemical Society,"Le Quocviet, Suh Juhan, Choi Jinjoo, Park Gyu-thae, Lee Jung-weon, Shim Gayong, Oh Yukyoung",7442-7462,Article,ACS Nano
495,Noncovalent tethering of nucleic acid aptamer on DNA nanostructure for targeted photo/chemo/gene therapies,https://www.scopus.com/authid/detail.uri?authorId=7402125977&amp,Oh Y.-K.,Elsevier Inc.,"Shim Gayong, Park Jinwon, Kim Mi-gyeong, Yang Geon, Lee Yeon, Oh Yukyoung",102053,Article,"Nanomedicine: Nanotechnology, Biology, and Medicine"
496,Biomimetic polymeric nanoparticle-based photodynamic immunotherapy and protection against tumor rechallenge,https://www.scopus.com/authid/detail.uri?authorId=7402125977&amp,Shim G.,Royal Society of Chemistry,"Kim Dongyoon, Byun Junho, Park Jinwon, Lee Yeon, Shim Gayong, Oh Yukyoung",1106-1116,Article,Biomaterials Science
497,0,0,0,0,0,0,0,
498,0,0,0,0,0,0,0,
499,0,0,0,0,0,0,0,
500,0,0,0,0,0,0,0,
501,The role of CSR proximity and psychological distance as a marketing strategy,https://www.scopus.com/authid/detail.uri?authorId=57189702853&amp,Ahn S.-S.,Korea Distribution Science Association (KODISA),"Kim Dong-tae, Kim Moon-seop, Ahn Sungsook",75-83,Article,Journal of Distribution ScienceOpen Access
502,Study on the donation and consumer attitude for the retail brand management,https://www.scopus.com/authid/detail.uri?authorId=44461556300&amp,Kim M.-S.,Korea Distribution Science Association (KODISA),"Ahn Sungsook, Kim Yong-cheol, Kim Moon-seop",49-56,Article,Journal of Distribution ScienceOpen Access
503,Do we always adopt Facebook friends’ eWOM postings? The role of social identity and threat,https://www.scopus.com/authid/detail.uri?authorId=56164669500&amp,Park Y.,Taylor and Francis Ltd.,"Kim Yaeri, Park Yookyung, Lee Youseok, Park Kiwan",86-104,Article,International Journal of Advertising
504,The underdog trap: The moderating role of transgression type in forgiving underdog brands,https://www.scopus.com/authid/detail.uri?authorId=57203985319&amp,Stacey Lee S.,Wiley-Liss Inc.,"Kim Yaeri, Park Kiwan, Stacey Lee Seojin",28-40,Article,Psychology and Marketing
505,Modified pyramid of CSR for corporate image and customer loyalty: Focusing on the moderating role of the CSR experience,https://www.scopus.com/authid/detail.uri?authorId=56236834600&amp,Roh T.,MDPI AG,"Lee Seojin Stacey, Kim Yaeri, Roh Taewoo",4745,Article,Sustainability (Switzerland)Open Access
506,Taking another look at airline CSR: How required CSR and desired CSR affect customer loyalty in the airline industry,https://www.scopus.com/authid/detail.uri?authorId=56236834600&amp,Roh T.,MDPI AG,"Kim Yaeri, Lee Seojin Stacey, Roh Taewoo",4281,Article,Sustainability (Switzerland)Open Access
507,An Overview of the MPEG-5 Essential Video Coding Standard [Standards in a Nutshell],https://www.scopus.com/authid/detail.uri?authorId=7006157400&amp,Copyright 2020 Elsevier B.V. All rights reserved.,Institute of Electrical and Electronics Engineers Inc.,"Choi Kiho, Chen Jianle, Rusanovskyy Dmytro, Choi Kwangpyo, Jang Eueeseon",160-167,Article,IEEE Signal Processing Magazine
508,"Video Codec Using Flexible Block Partitioning and Advanced Prediction, Transform and Loop Filtering Technologies",https://www.scopus.com/authid/detail.uri?authorId=36925947000&amp,Chen J.,Institute of Electrical and Electronics Engineers Inc.,"Choi Kiho, Chen Jianle, Park Minwoo, Yang Haitao, Choi Woongil, Ikonin Sergey V., Piao Yinji, Esenlik Semih, Park Minsoo, Wang Yekui, Choi Narae, Zhao Yin, Jeong Seungsoo, Chen H., Tamse Anish, Filippov Alexey, Yang Heechul, Ma Xiang, Min Junghye, Chernyak Roman I., Jin Bora, Kotra Anand Meher, Lee Sunil, Gao Han, Kim Chanyul, Solovyev Timofey, Choi Kwangpyo, Rufitskiy Vasily, Sychev Maxim, Xu Weiwei, Wang Tian, Park Jeonghoon",1326-1345,Article,IEEE Transactions on Circuits and Systems for Video Technology
509,The Joint Exploration Model (JEM) for Video Compression with Capability beyond HEVC,https://www.scopus.com/authid/detail.uri?authorId=7202322255&amp,Chen J.,Institute of Electrical and Electronics Engineers Inc.,"Chen Jianle, Karczewicz Marta, Huang Yuwen, Choi Kiho, Ohm Jensrainer, Sullivan Gary J.",1208-1225,Article,IEEE Transactions on Circuits and Systems for Video Technology
510,0,0,0,0,0,0,0,
511,pH-adjusted solvent extraction and reversed-phase HPLC quantification of isoflavones from soybean (Glycine max (L.) Merr.),https://www.scopus.com/authid/detail.uri?authorId=57215043726&amp,Kim D.-O.,Blackwell Publishing Inc.,"Cho Chi-heung, Jung Young-sung, Nam Tae-gyu, Rha Chan Su, Ko Min-ji, Jang Davin, Kim Hong-sik, Kim Dae-ok",673-681,Article,Journal of Food Science
512,Enrichment of polyglucosylated isoflavones from soybean isoflavone aglycones using optimized amylosucrase transglycosylation,https://www.scopus.com/authid/detail.uri?authorId=7409764922&amp,Kim D.-O.,MDPI AG,"Jung Young-sung, Kim Ye-jin, Kim Aaron Taehwan, Jang Davin, Kim Mi-seon, Seo Dong-ho, Nam Tae-gyu, Rha Chan Su, Park Cheonseok, Kim Dae-ok",181,Article,MoleculesOpen Access
513,Stability and fermentability of green tea flavonols in in-vitro-simulated gastrointestinal digestion and human fecal fermentation,https://www.scopus.com/authid/detail.uri?authorId=57208377113&amp,Kim D.-O.,MDPI AG,"Rha Chan Su, Seong Hyunbin, Jung Young-sung, Jang Davin, Kwak Jun-gu, Kim Dae-ok, Han Namsoo",5890,Article,International Journal of Molecular SciencesOpen Access
514,Simple and Efficient Production of Highly Soluble Daidzin Glycosides by Amylosucrase from Deinococcus geothermalis,https://www.scopus.com/authid/detail.uri?authorId=7408414586&amp,Park C.-S.,American Chemical Society,"Rha Chan Su, Kim Eun-ryoung, Kim Ye-jin, Jung Young-sung, Kim Dae-ok, Park Cheonseok",2019,Article,Journal of Agricultural and Food Chemistry
515,Simultaneous optimal production of flavonol aglycones and degalloylated catechins from green tea using a multi-function food-grade enzyme,https://www.scopus.com/authid/detail.uri?authorId=7409764922&amp,Rha C.-S.,MDPI AG,"Rha Chan Su, Kim Shin-woo, Byoun Kyounghee, Hong Yongdeog, Kim Dae-ok",861,Article,CatalystsOpen Access
516,Site-specific α-glycosylation of hydroxyflavones and hydroxyflavanones by amylosucrase from Deinococcus geothermalis,https://www.scopus.com/authid/detail.uri?authorId=7408414586&amp,Park C.-S.,Elsevier Inc.,"Rha Chan Su, Jung Young-sung, Seo Dong-ho, Kim Dae-ok, Park Cheonseok",109361,Article,Enzyme and Microbial Technology
517,Enzymatic synthesis of novel quercetin sialyllactoside derivatives,https://www.scopus.com/authid/detail.uri?authorId=7003827998&amp,Pandey R.P.,Taylor and Francis Ltd.,"Darsandhari Sumangala, Bae Jae-yoon, Shrestha Biplav, Yamaguchi Tokutaro, Jung Hye-jin, Han Jangmi, Rha Chan Su, Pandey Ramesh Prasad, Sohng Jaekyung",1944-1952,Article,Natural Product Research
518,Theaflavin-enriched fraction stimulates adipogenesis in human subcutaneous fat cells,https://www.scopus.com/authid/detail.uri?authorId=57203772993&amp,Park P.J.,MDPI AG,"Park Phil-june, Rha Chan Su, Kim Sungtae",2034,Article,International Journal of Molecular SciencesOpen Access
519,Enzymatic modification of daidzin using heterologously expressed amylosucrase in Bacillus subtilis,https://www.scopus.com/authid/detail.uri?authorId=7408414586&amp,Park C.-S.,The Korean Society of Food Science and Technology,"Kim Eun-ryoung, Rha Chan Su, Jung Young-sung, Choi Jungmin, Kim Gitae, Jung Dong Hyun, Kim Tae-jip, Seo Dong-ho, Kim Dae-ok, Park Cheonseok",165-174,Article,Food Science and Biotechnology
520,Impact of Bioconversion of Gallated Catechins and Flavonol Glycosides on Bioaccessibility and Intestinal Cellular Uptake of Catechins,https://www.scopus.com/authid/detail.uri?authorId=8693536300&amp,Shim S.-M.,American Chemical Society,"Choi Eunhye, Rha Chan Su, Balusamy Sri Renuka Devi, Kim Dae-ok, Shim Soonmi",2331-2339,Article,Journal of Agricultural and Food Chemistry
521,High-efficiency enzymatic production of α-isoquercitrin glucosides by amylosucrase from Deinococcus geothermalis,https://www.scopus.com/authid/detail.uri?authorId=7408414586&amp,Park C.-S.,Elsevier Inc.,"Rha Chan Su, Choi Jungmin, Jung Young-sung, Kim Eun-ryoung, Ko Min-ji, Seo Dong-ho, Kim Dae-ok, Park Cheonseok",84-90,Article,Enzyme and Microbial Technology
522,Enzymatic synthesis of α-flavone glucoside via regioselective transglucosylation by amylosucrase from Deinococcus geothermalis,https://www.scopus.com/authid/detail.uri?authorId=35194714900&amp,Seo D.-H.,Public Library of Science,"Jang Sewon, Cho Chi-heung, Jung Young-sung, Rha Chan Su, Nam Tae-gyu, Kim Dae-ok, Lee Yeong-geun, Baek And Nam In, Park Cheonseok, Lee Byung-hoo, Lee So-young, Shin Hee-soon, Seo Dong-ho",e0207466,Article,PLoS ONEOpen Access
523,Effects of commonly used infusion method on catechin content and antioxidant capacities of pure green tea packaged in tea bags,https://www.scopus.com/authid/detail.uri?authorId=7409764922&amp,Kim D.-O.,Korean Society of Food Science and Technology,"Kim Mi-seon, Rha Chan Su, Kim Dae-ok",356-360,Article,Korean Journal of Food Science and TechnologyOpen Access
524,Neuroprotective effects of astringency-removed peel extracts of Diospyros kaki Thunb. cv. Cheongdo-Bansi on oxidatively-stressed PC-12 cells,https://www.scopus.com/authid/detail.uri?authorId=7409764922&amp,Copyright 2018 Elsevier B.V. All rights reserved.,Korean Society of Food Science and Technology,"Jeong Da Wool, Cho Chi-heung, Rha Chan Su, Lee Seunghwan, Kim Dae-ok",538-543,Article,Korean Journal of Food Science and TechnologyOpen Access
525,"Antioxidative, anti-inflammatory, and anticancer effects of purified flavonol glycosides and aglycones in green tea",https://www.scopus.com/authid/detail.uri?authorId=7409764922&amp,Kim D.-O.,MDPI AG,"Rha Chan Su, Jeong Hyun-woo, Park Saitbyul, Lee Siyoung, Jung Young-sung, Kim Dae-ok",278,Article,AntioxidantsOpen Access
526,Polymorphism of antibiotic-inactivating enzyme driven by ecology expands the environmental resistome,https://www.scopus.com/authid/detail.uri?authorId=7102247849&amp,Cha C.-J.,Nature Publishing Group,"Kim Dae-wi, Thawng Cung Nawl, Choi Jung-hye, Lee Kihyun, Cha Chang-jun",267-276,Article,ISME Journal
527,Mobile resistome of human gut and pathogen drives anthropogenic bloom of antibiotic resistance,https://www.scopus.com/authid/detail.uri?authorId=7102247849&amp,Cha C.-J.,BioMed Central Ltd.,"Lee Kihyun, Kim Dae-wi, Lee Do-hoon, Kim Yong-seok, Bu Ji-hye, Cha Ju-hee, Thawng Cung Nawl, Hwang Eun-mi, Seong Hoonje, Sul Woo Jun, Wellington Elizabeth Margaret Helen, Quince Christopher, Cha Chang-jun",2,Article,MicrobiomeOpen Access
528,A novel sulfonamide resistance mechanism by two-component flavin-dependent monooxygenase system in sulfonamide-degrading actinobacteria,https://www.scopus.com/authid/detail.uri?authorId=7102247849&amp,Cha C.-J.,Elsevier Ltd,"Kim Dae-wi, Thawng Cung Nawl, Lee Kihyun, Wellington Elizabeth Margaret Helen, Cha Chang-jun",206-215,Article,Environment InternationalOpen Access
529,0,0,0,0,0,0,0,
530,0,0,0,0,0,0,0,
531,Comparative Proteomic Analysis of Three Xanthomonas spp. Cultured in Minimal and Rich Media,https://www.scopus.com/authid/detail.uri?authorId=57203291786&amp,Han S.-W.,Wiley-VCH Verlag,"Park Hye-jee, Bae Nahee, Park Hanbi, Kim Dae-wi, Han Sangwook",1700142,Article,Proteomics
532,Influence of dietary avilamycin on ileal and cecal microbiota in broiler chickens,https://www.scopus.com/authid/detail.uri?authorId=7102247849&amp,Cha C.-J.,Oxford University Press,"Choi Jung-hye, Lee Kyu-chan, Kim Dae-wi, Kil Dong-yong, Kim Geun-bae, Cha Chang-jun",970-979,Article,Poultry Science
533,0,0,0,0,0,0,0,
534,0,0,0,0,0,0,0,
535,Diffusion of ISO 14001 in a developmental state: The case of Korea,https://www.scopus.com/authid/detail.uri?authorId=57188654599&amp,Oh J.R.,Johns Hopkins University Press,"Baek Kyungmin, Oh Jeong-rok",505-532,Article,Asian Perspective
536,0,0,0,0,0,0,0,
537,"Acceleration of somatic cell reprogramming into the induced pluripotent stem cell using a mycosporine-like amino acid, Porphyra 334",https://www.scopus.com/authid/detail.uri?authorId=26026377700&amp,Moh S.H.,Nature Research,"Yoo Junsang, Kim Junyeop, Lee Jeong-hun, Kim Hyein, Jang Sung-joo, Seo Hyo-hyun, Oh Seung-taek, Hyeon Seung-jae, Ryu Hoon, Kim Jongpil, Moh Sang-hyun",3684,Article,Scientific ReportsOpen Access
538,0,0,0,0,0,0,0,
539,In vivo neuronal gene editing via CRISPR–Cas9 amphiphilic nanocomplexes alleviates deficits in mouse models of Alzheimer’s disease,https://www.scopus.com/authid/detail.uri?authorId=56021319400&amp,Kim J.,Nature Publishing Group,"Park Hanseul, Oh Jungju, Shim Gayong, Cho Byounggook, Chang Yujung, Kim Siyoung, Baek Soonbong, Kim Hongwon, Shin Jeain, Choi Hwan, Yoo Junsang, Kim Junyeop, Jun Won, Lee Minhyung, Lengner Christopher Joachim, Oh Yukyoung, Kim Jongpil",524-528,Article,Nature Neuroscience
540,Acupuncture Alleviates Levodopa-Induced Dyskinesia via Melanin-Concentrating Hormone in Pitx3-Deficient aphakia and 6-Hydroxydopamine-Lesioned Mice,https://www.scopus.com/authid/detail.uri?authorId=7601566951&amp,Park H.-J.,Humana Press Inc.,"Kim Yu-kang, Lee Ahreum, Park Hanseul, Yoo Junsang, Ahn Sora, Jeon Songhee, Kim Jongpil, Park Hi-Joon",2408-2423,Article,Molecular Neurobiology
541,0,0,0,0,0,0,0,
542,0,0,0,0,0,0,0,
543,Distinct roles of parvalbumin and somatostatin interneurons in gating the synchronization of spike times in the neocortex,https://www.scopus.com/authid/detail.uri?authorId=9435550800&amp,Kwag J.,American Association for the Advancement of Science,"Jang Hyun-jae, Chung Hyowon, Rowland James M., Richards Blake A., Kohl Michael M., Kwag Jeehyun",aay5333,Article,Science AdvancesOpen Access
544,Dissociation of somatostatin and parvalbumin interneurons circuit dysfunctions underlying hippocampal theta and gamma oscillations impaired by amyloid β oligomers in vivo,https://www.scopus.com/authid/detail.uri?authorId=9435550800&amp,Kwag J.,Springer,"Chung Hyowon, Park Kyerl, Jang Hyun Jae, Kohl Michael M., Kwag Jeehyun",935-954,Article,Brain Structure and Function
545,Optogenetic activation of parvalbumin and somatostatin interneurons selectively restores theta-nested gamma oscillations and oscillation-induced spike timing-dependent long-term potentiation impaired by amyloid β oligomers,https://www.scopus.com/authid/detail.uri?authorId=9435550800&amp,This record is sourced from MEDLINE/PubMed a database of the U.S. National Library of Medicine,NLM (Medline),"Park Kyerl, Lee Jaedong, Jang Hyun Jae, Richards Blake A., Kohl Michael M., Kwag Jeehyun",7,Article,BMC biologyOpen Access
546,Spatiotemporally random and diverse grid cell spike patterns contribute to the transformation of grid cell to place cell in a neural network model,https://www.scopus.com/authid/detail.uri?authorId=9435550800&amp,Kwag J.,Public Library of Science,"Park Sahn Woo, Jang Hyun Jae, Kim Mincheol, Kwag Jeehyun",e0225100,Article,PLoS ONEOpen Access
547,0,0,0,0,0,0,0,
548,0,0,0,0,0,0,0,
549,0,0,0,0,0,0,0,
550,0,0,0,0,0,0,0,
551,0,0,0,0,0,0,0,
552,0,0,0,0,0,0,0,
553,Entry market choices and post-entry growth patterns among born globals in consumer goods sectors,https://www.scopus.com/authid/detail.uri?authorId=57190302831&amp,Jin B.,Emerald Group Publishing Ltd.,"Jin Byoungho Ellie, Chung Jae-eun, Yang Heesoon, Jeong So-won",958-980,Article,International Marketing Review
554,NIE-based SME brand building in foreign markets: an exploratory study,https://www.scopus.com/authid/detail.uri?authorId=57195943106&amp,Jeong S.W.,Emerald Group Publishing Ltd.,"Chung Jae-eun, Jin Byoungho Ellie, Jeong So-won, Yang Heesoon",63-79,Article,Journal of Product and Brand Management
555,The temporal effects of social and business networks on international performance of South Korean SMEs,https://www.scopus.com/authid/detail.uri?authorId=55562155600&amp,Jung S.,Emerald Group Publishing Ltd.,"Jeong So-won, Jin Byoungho Ellie, Jung Sojin Sojin",1042-1057,Article,Asia Pacific Journal of Marketing and Logistics
556,Impact of External Knowledge Inflow on Product and Process Innovation of Korean SMEs: Absorptive Capacity as a Mediator,https://www.scopus.com/authid/detail.uri?authorId=24729577500&amp,Roh J.-S.,SAGE Publications Inc.,"Jeong So-won, Chung Jae-eun, Roh Jung-sim",219-234,Article,Clothing and Textiles Research Journal
557,Dimensional effects of Korean SME’s entrepreneurial orientation on internationalization and performance: the mediating role of marketing capability,https://www.scopus.com/authid/detail.uri?authorId=57190302831&amp,Jeong S.W.,Springer New York LLC,"Jin Byoungho Ellie, Jung Sojin Sojin, Jeong So-won",195-215,Article,International Entrepreneurship and Management Journal
558,Network evolution and cultivation patterns during the internationalization process: Case analyses from Korean SMEs,https://www.scopus.com/authid/detail.uri?authorId=57195943106&amp,Yang H.,Palgrave Macmillan Ltd.,"Jeong So-won, Jin Byoungho Ellie, Chung Jae-eun, Yang Heesoon",323-351,Article,Asian Business and Management
559,Enhanced oxygen exchange of perovskite oxide surfaces through strain-driven chemical stabilization,https://www.scopus.com/authid/detail.uri?authorId=27170700900&amp,Han J.W.,Royal Society of Chemistry,"Koo Bonjae, Kwon Hyunguk, Kim Yeonju, Seo Han Gil, Han Jeongwoo, Jung Woochul",71-77,Article,Energy and Environmental Science
560,0,0,0,0,0,0,0,
561,"Controlling the size of Pt nanoparticles with a cationic surfactant, C: NTABr",https://www.scopus.com/authid/detail.uri?authorId=27170700900&amp,Jung W.,Royal Society of Chemistry,"Seo Jongsu, Lee Siwon, Koo Bonjae, Jung Woochul",2010-2015,Article,CrystEngComm
562,"Study of the surface reaction kinetics of (La,Sr)MnO3-: δ oxygen carriers for solar thermochemical fuel production",https://www.scopus.com/authid/detail.uri?authorId=27170700900&amp,Jung W.,Royal Society of Chemistry,"Kim Yeonju, Jeong Seung-jin, Koo Bonjae, Lee Siwon, Kwak Nowoo, Jung Woochul",13082-13089,Article,Journal of Materials Chemistry A
563,Exceptional Tunability over Size and Density of Spontaneously Formed Nanoparticles via Nucleation Dynamics,https://www.scopus.com/authid/detail.uri?authorId=57216563542&amp,Kim B.-J.,American Chemical Society,"Kim Jun-kyu, Jo Yong-ryun, Kim Seunghyun, Koo Bonjae, Kim Jun-hyuk, Kim Bong-joong, Jung Woo-chul",24039-24047,Article,ACS Applied Materials and Interfaces
564,Sintering-resistant platinum electrode achieved through atomic layer deposition for thin-film solid oxide fuel cells,https://www.scopus.com/authid/detail.uri?authorId=57216563542&amp,Jung W.,Elsevier Ltd,"Seo Han Gil, Ji Sanghoon, Seo Jongsu, Kim Sanwi, Koo Bonjae, Choi Yoonseok, Kim Hyunseung, Kim Jeonghwan, Kim Taek-soo, Jung Woo-chul",155347,Article,Journal of Alloys and Compounds
565,Sr Segregation in Perovskite Oxides: Why It Happens and How It Exists,https://www.scopus.com/authid/detail.uri?authorId=27170700900&amp,Han J.W.,Cell Press,"Koo Bonjae, Kim Kyeounghak, Kim Jun-kyu, Kwon Hyunguk, Han Jeongwoo, Jung Woochul",1476-1499,Review,Joule
566,0,0,0,0,0,0,0,
567,0,0,0,0,0,0,0,
568,0,0,0,0,0,0,0,
569,0,0,0,0,0,0,0,
570,0,0,0,0,0,0,0,
571,"Bioresorbable, Miniaturized Porous Silicon Needles on a Flexible Water-Soluble Backing for Unobtrusive, Sustained Delivery of Chemotherapy",https://www.scopus.com/authid/detail.uri?authorId=55574123266&amp,This record is sourced from MEDLINE/PubMed a database of the U.S. National Library of Medicine,NLM (Medline),"Kim Hyungjun, Lee Heungsoo, Jeon Yale, Park Woohyun, Zhang Yue, Kim Bongjoong, Jang Hanmin, Xu Baoxing, Yeo Yoon, Kim Dong-rip, Lee Chi Hwan",7227-7236,Article,ACS nano
572,0,0,0,0,0,0,0,
