,Title,Link,cor_A,inst,Author,vol_num,paper_type,Journal
0,Fate analysis and impact assessment for vehicle Polycyclic Aromatic Hydrocarbons (PAHs) emitted from metropolitan city using multimedia fugacity model,https://www.scopus.com/authid/detail.uri?authorId=7201746395&amp,Yoo C.,Korean Institute of Chemical Engineers,"Rhee Gahee, Hwangbo Soonho, Yoo Changkyoo",479-495,Article,Korean Chemical Engineering Research
1,Hydrogen-based self-sustaining integrated renewable electricity network (HySIREN) using a supply-demand forecasting model and deep-learning algorithms,https://www.scopus.com/authid/detail.uri?authorId=7201746395&amp,Yoo C.,Elsevier Ltd,"Hwangbo Soonho, Nam Kijeon, Heo Sungku, Yoo Changkyoo",353-367,Article,Energy Conversion and Management
2,A deep learning-based forecasting model for renewable energy scenarios to guide sustainable energy policy: A case study of Korea,https://www.scopus.com/authid/detail.uri?authorId=7201746395&amp,Yoo C.,Elsevier Ltd,"Nam Kijeon, Hwangbo Soonho, Yoo Changkyoo",109725,Article,Renewable and Sustainable Energy Reviews
3,Development of an integrated network for waste-to-energy and central utility systems considering air pollutant emissions pinch analysis,https://www.scopus.com/authid/detail.uri?authorId=7201746395&amp,Yoo C.,Elsevier Ltd,"Hwangbo Soonho, Sin G., Rhee Gahee, Yoo Changkyoo",119746,Article,Journal of Cleaner Production
4,Optimal network design of hydrogen production by integrated utility and biogas supply networks,https://www.scopus.com/authid/detail.uri?authorId=7201746395&amp,Yoo C.,Elsevier Ltd,"Hwangbo Soonho, Lee Seungchul, Yoo Changkyoo",195-209,Article,Applied Energy
5,Mathematical model to optimize design of integrated utility supply network and future global hydrogen supply network under demand uncertainty,https://www.scopus.com/authid/detail.uri?authorId=55316276700&amp,Han J.,Elsevier Ltd,"Hwangbo Soonho, Lee Inbeum, Han Jeehoon",257-267,Article,Applied Energy
6,0,0,0,0,0,0,0,
7,Integrated hydrogen supply networks for waste biogas upgrading and hybrid carbon-hydrogen pinch analysis under hydrogen demand uncertainty,https://www.scopus.com/authid/detail.uri?authorId=7201746395&amp,Yoo C.,Elsevier Ltd,"Hwangbo Soonho, Nam Kijeon, Han Jeehoon, Lee Inbeum, Yoo Changkyoo",386-397,Article,Applied Thermal Engineering
8,Sustainable and reliable design of reverse osmosis desalination with hybrid renewable energy systems through supply chain forecasting using recurrent neural networks,https://www.scopus.com/authid/detail.uri?authorId=7201746395&amp,Yoo C.,Elsevier Ltd,"Li Qian, Loy-Benitez Jorge, Nam Kijeon, Hwangbo Soonho, Rashidi Jouan, Yoo Changkyoo",277-292,Article,Energy
9,Transitioning of localized renewable energy system towards sustainable hydrogen development planning: P-graph approach,https://www.scopus.com/authid/detail.uri?authorId=7201746395&amp,Yoo C.K.,Elsevier Ltd,"Lim Juin Yau, How B. S., Rhee Gahee, Hwangbo Soonho, Yoo Changkyoo",114635,Article,Applied Energy
10,0,0,0,0,0,0,0,
11,Gain scheduling based ventilation control with varying periodic indoor air quality (IAQ) dynamics for healthy IAQ and energy savings,https://www.scopus.com/authid/detail.uri?authorId=7201746395&amp,Yoo C.K.,Elsevier Ltd,"Lee Seungchul, Hwangbo Soonho, Kim Jeong Tai, Yoo Changkyoo",275-286,Article,Energy and Buildings
12,"A systematic approach of removal mechanisms, control and optimization of silver nanoparticle in wastewater treatment plants",https://www.scopus.com/authid/detail.uri?authorId=7201746395&amp,Yoo C.,Elsevier B.V.,"Vilela Paulina, Liu Hongbin, Lee Seungchul, Hwangbo Soonho, Nam Kijeon, Yoo Changkyoo",989-998,Article,Science of the Total Environment
13,Interpretation and diagnosis of fouling progress in membrane bioreactor plants using a periodic pattern recognition method,https://www.scopus.com/authid/detail.uri?authorId=7201746395&amp,Yoo C.K.,Springer New York LLC,"Nam Kijeon, Kim Minjeong, Lee Seungchul, Hwangbo Soonho, Yoo Changkyoo",2966-2977,Article,Korean Journal of Chemical Engineering
14,0,0,0,0,0,0,0,
15,0,0,0,0,0,0,0,
16,0,0,0,0,0,0,0,
17,0,0,0,0,0,0,0,
18,0,0,0,0,0,0,0,
19,Autophagy Caught in the Act: A Supramolecular FRET Pair Based on an Ultrastable Synthetic Host–Guest Complex Visualizes Autophagosome–Lysosome Fusion,https://www.scopus.com/authid/detail.uri?authorId=15121037600&amp,Park K.M.,Wiley-VCH Verlag,"Li Meng, Lee Ara, Kim Kyung-lock, Murray James, Shrinidhi Annadka, Sung Gihyun, Park Kyengmin, Kim Kimoon",2120-2125,Article,Angewandte Chemie - International Edition
20,Mono-allyloxylated Cucurbit[7]uril Acts as an Unconventional Amphiphile To Form Light-Responsive Vesicles,https://www.scopus.com/authid/detail.uri?authorId=15121037600&amp,Park K.M.,Wiley-VCH Verlag,"Park Kyengmin, Baek Kangkyun, Ko Young-ho, Shrinidhi Annadka, Murray James, Jang Won-hyuk, Kim Kihean, Lee Jun Seok, Yoo Jejoong, Kim Sungwan, Kim Kimoon",3132-3136,Article,Angewandte Chemie - International Edition
21,Supramolecular latching system based on ultrastable synthetic binding pairs as versatile tools for protein imaging,https://www.scopus.com/authid/detail.uri?authorId=15121037600&amp,Park K.M.,Nature Publishing Group,"Kim Kyung-lock, Sung Gihyun, Sim Jaehwan, Murray James, Li Meng, Lee Ara, Shrinidhi Annadka, Park Kyengmin, Kim Kimoon",1712,Article,Nature CommunicationsOpen Access
22,Self-assembled adhesive biomaterials formed by a genetically designed fusion protein,https://www.scopus.com/authid/detail.uri?authorId=15121037600&amp,Cha H.J.,Royal Society of Chemistry,"Aich Pulakesh, An Jaeyeon, Yang Byeongseon, Ko Young-ho, Kim Junghyun, Murray James, Cha Hyungjoon, Roh Joon-ho, Park Kyengmin, Kim Kimoon",12642-12645,Article,Chemical Communications
23,Cucurbit[7]uril-conjugated dyes as live cell imaging probes: Investigation on their cellular uptake and excretion pathways,https://www.scopus.com/authid/detail.uri?authorId=15121037600&amp,Copyright 2019 Elsevier B.V. All rights reserved.,Royal Society of Chemistry,"Li Meng, Lee Ara, Kim Sungwan, Shrinidhi Annadka, Park Kyengmin, Kim Kimoon",6215-6220,Article,Organic and Biomolecular Chemistry
24,Cucurbit[: N] uril-based amphiphiles that self-assemble into functional nanomaterials for therapeutics,https://www.scopus.com/authid/detail.uri?authorId=15121037600&amp,Park K.M.,Royal Society of Chemistry,"Park Kyengmin, Hur Moon-young, Ghosh Suman Kr, Boraste Deepak Ramdas, Kim Sungwan, Kim Kimoon",10654-10664,Article,Chemical Communications
25,Superacid-Mediated Functionalization of Hydroxylated Cucurbit[ n]urils,https://www.scopus.com/authid/detail.uri?authorId=15121037600&amp,Lee E.,American Chemical Society,"Ghosh Suman Kr, Dhamija Avinash, Ko Young-ho, An Jaeyeon, Hur Moon-young, Boraste Deepak Ramdas, Seo Jongcheol, Lee Eungsung, Park Kyengmin, Kim Kimoon",17503-17506,Article,Journal of the American Chemical Society
26,Bio-orthogonal Supramolecular Latching inside Live Animals and Its Application for in Vivo Cancer Imaging,https://www.scopus.com/authid/detail.uri?authorId=15121037600&amp,Park K.M.,American Chemical Society,"Li Meng, Kim Sungwan, Lee Ara, Shrinidhi Annadka, Ko Young-ho, Lim Hae Gyun, Kim Hyung Ham, Bae Ki-beom, Park Kyengmin, Kim Kimoon",43920-43927,Article,ACS Applied Materials and Interfaces
27,Supra-blot: An accurate and reliable assay for detecting target proteins with a synthetic host molecule-enzyme hybrid,https://www.scopus.com/authid/detail.uri?authorId=15121037600&amp,Rhee H.-W.,Royal Society of Chemistry,"Sung Gihyun, Lee Song-yi, Kang Myeong-gyun, Kim Kyung-lock, An Jaeyeon, Sim Jaehwan, Kim Sungwan, Kim Seungjoon, Ko Jaewon, Rhee Hyunwoo, Park Kyengmin, Kim Kimoon",1549-1552,Article,Chemical Communications
28,Template-Free Mesoporous Electrochromic Films on Flexible Substrates from Tungsten Oxide Nanorods,https://www.scopus.com/authid/detail.uri?authorId=6602304514&amp,Milliron D.J.,American Chemical Society,"Heo Sungyeon, Kim Jongwook, Ong Gary K., Milliron Delia J.",5756-5761,Article,Nano Letters
29,High Mobility in Nanocrystal-Based Transparent Conducting Oxide Thin Films,https://www.scopus.com/authid/detail.uri?authorId=6602304514&amp,Milliron D.J.,American Chemical Society,"Kim Byung-hyo, Staller Corey M., Cho Shin Hum, Heo Sungyeon, Garrison Carrie E., Kim Jongwook, Milliron Delia J.",3200-3208,Article,ACS Nano
30,Competition between Depletion Effects and Coupling in the Plasmon Modulation of Doped Metal Oxide Nanocrystals,https://www.scopus.com/authid/detail.uri?authorId=6602304514&amp,Milliron D.J.,American Chemical Society,"Tandon Bharat, Agrawal Ankit, Heo Sungyeon, Milliron Delia J.",2012-2019,Article,Nano Letters
31,Wide Dynamic Range in Tunable Electrochromic Bragg Stacks from Doped Semiconductor Nanocrystals,https://www.scopus.com/authid/detail.uri?authorId=6602304514&amp,Milliron D.J.,Wiley-VCH Verlag,"Heo Sungyeon, Agrawal Ankit, Milliron Delia J.",1904555,Article,Advanced Functional Materials
32,Solvothermally-synthesized tin-doped indium oxide plasmonic nanocrystals spray-deposited onto glass as near-infrared electrochromic films,https://www.scopus.com/authid/detail.uri?authorId=7006705433&amp,Maho A.,Elsevier B.V.,"Maho Anthony, Comeron Lamela Laura, Henrist Catherine, Henrard Luc, Tizei Luiz Henrique Galvão, Kociak Mathieu, Stéphan Odile, Heo Sungyeon, Milliron Delia J., Vertruyen Bénédicte, Cloots Rudi",110014,Article,Solar Energy Materials and Solar Cells
33,Electrochromic Niobium Oxide Nanorods,https://www.scopus.com/authid/detail.uri?authorId=6602304514&amp,Milliron D.J.,American Chemical Society,"Ong Gary K., Saez Cabezas Camila A., Dominguez Manuel N., Skj?rv? Susanne Linn, Heo Sungyeon, Milliron Delia J.",468-475,Article,Chemistry of Materials
34,"Spectrally tunable infrared plasmonic F,Sn:In2O3 nanocrystal cubes",https://www.scopus.com/authid/detail.uri?authorId=6602304514&amp,Milliron D.J.,American Institute of Physics Inc.,"Cho Shin Hum, Roccapriore Kevin M., Dass Chandriker Kavir, Ghosh Sandeep, Choi Junho, Noh Jungchul, Reimnitz Lauren C., Heo Sungyeon, Kim Kihoon, Xie Karen, Korgel Brian A., Li Xiaoqin, Hendrickson Joshua R., Hachtel Jordan Adam, Milliron Delia J.",14709,Article,Journal of Chemical Physics
35,Enhanced Coloration Efficiency of Electrochromic Tungsten Oxide Nanorods by Site Selective Occupation of Sodium Ions,https://www.scopus.com/authid/detail.uri?authorId=6602304514&amp,Milliron D.J.,American Chemical Society,"Heo Sungyeon, Dahlman Clayton J., Staller Corey M., Jiang Taizhi, Dolocan Andrei D., Korgel Brian A., Milliron Delia J.",2072-2079,Article,Nano Letters
36,Charge carrier concentration dependence of ultrafast plasmonic relaxation in conducting metal oxide nanocrystals,https://www.scopus.com/authid/detail.uri?authorId=36991222000&amp,Copyright 2017 Elsevier B.V. All rights reserved.,Royal Society of Chemistry,"Johns Robert W., Blemker Michelle A., Azzaro Michael S., Heo Sungyeon, Runnerstrom Evan L., Milliron Delia J., Roberts Sean T.",5757-5763,Article,Journal of Materials Chemistry C
37,Systemic Brain Delivery of Antisense Oligonucleotides across the Blood–Brain Barrier with a Glucose-Coated Polymeric Nanocarrier,https://www.scopus.com/authid/detail.uri?authorId=35448581000&amp,Miyata K.,Wiley-VCH Verlag,"Min Hyun-su, Kim Hyun Jin, Naito Mitsuru, Ogura Satomi, Toh Kazuko, Hayashi Kotaro, Kim Beobsoo, Fukushima Shigeto, Anraku Yasutaka, Miyata Kanjiro, Kataoka Kazunori",8173-8180,Article,Angewandte Chemie - International Edition
38,0,0,0,0,0,0,0,
39,0,0,0,0,0,0,0,
40,In vivo rendezvous of small nucleic acid drugs with charge-matched block catiomers to target cancers,https://www.scopus.com/authid/detail.uri?authorId=35448581000&amp,Miyata K.,Nature Publishing Group,"Watanabe Sumiyo, Hayashi Kotaro, Toh Kazuko, Kim Hyun Jin, Liu Xueying, Chaya Hiroyuki, Fukushima Shigeto, Katsushima Keisuke, Kondo Yutaka, Uchida Satoshi, Ogura Satomi, Nomoto Takahiro, Takemoto Hiroyasu, Cabral Horacio, Kinoh Hiroaki, Tanaka Hiroyoshi Y., Kano Mitsunobu R., Matsumoto Yu, Fukuhara Hiroshi, Uchida Shunya, Nangaku Masaomi, Osada Kensuke, Nishiyama Nobuhiro, Miyata Kanjiro, Kataoka Kazunori",1894,Article,Nature CommunicationsOpen Access
41,Small Delivery Vehicles of siRNA for Enhanced Cancer Targeting,https://www.scopus.com/authid/detail.uri?authorId=8568946500&amp,Miyata K.,American Chemical Society,"Kim Hyun Jin, Yi Yu, Kim Ahram, Miyata Kanjiro",2377-2390,Article,Biomacromolecules
42,Tuned Density of Anti-Tissue Factor Antibody Fragment onto siRNA-Loaded Polyion Complex Micelles for Optimizing Targetability into Pancreatic Cancer Cells,https://www.scopus.com/authid/detail.uri?authorId=35448581000&amp,Miyata K.,American Chemical Society,"Min Hyun-su, Kim Hyun Jin, Ahn Jooyeon, Naito Mitsuru, Hayashi Kotaro, Toh Kazuko, Kim Beobsoo, Matsumura Yasuhiro, Kwon Ick-chan, Miyata Kanjiro, Kataoka Kazunori",2320-2329,Article,Biomacromolecules
43,0,0,0,0,0,0,0,
44,0,0,0,0,0,0,0,
45,Nanoparticle delivery of Cas9 ribonucleoprotein and donor DNA in vivo induces homology-directed DNA repair,https://www.scopus.com/authid/detail.uri?authorId=35514354900&amp,Conboy I.,Nature Publishing Group,"Lee Kunwoo, Conboy Michael J., Park Hyo-min, Jiang Fuguo, Kim Hyun Jin, DeWitt Mark A., Mackley Vanessa A., Chang Kevin, Rao Anirudh, Skinner Colin M., Shobha Tamanna, Mehdipour Melod, Liu Hui, Huang Wenchin, Lan Freeman, Bray Nicolas L., Li Song, Corn Jacob E., Kataoka Kazunori, Doudna Jennifer A., Conboy Irina M., Murthy Niren Sanjeeva",889-901,Article,Nature Biomedical Engineering
46,Virus-Mimicking Chimaeric Polymersomes Boost Targeted Cancer siRNA Therapy In Vivo,https://www.scopus.com/authid/detail.uri?authorId=7402336602&amp,Meng F.,Wiley-VCH Verlag,"Zou Yan, Zheng Meng, Yang Weijing, Meng Fenghua, Miyata Kanjiro, Kim Hyun Jin, Kataoka Kazunori, Zhong Zhiyuan",1703285,Article,Advanced Materials
47,DNA-SWCNT biosensors allow real-time monitoring of therapeutic responses in pancreatic ductal adenocarcinoma,https://www.scopus.com/authid/detail.uri?authorId=7102685813&amp,Mukhopadhyay D.,American Association for Cancer Research Inc.,"Bhattacharya Santanu, Gong Xun, Wang Engfeng, Dutta Shamit Kumar, Caplette Joseph R., Son Manki, Nguyen Freddy T., Strano Michael S., Mukhopadhyay Debabrata",4515-4523,Article,Cancer Research
48,The bioelectronic nose and tongue using olfactory and taste receptors: Analytical tools for food quality and safety assessment,https://www.scopus.com/authid/detail.uri?authorId=34969448600&amp,Park T.H.,Elsevier Inc.,"Son Manki, Park Taihyun",371-379,Review,Biotechnology Advances
49,"A triangle study of human, instrument and bioelectronic nose for non-destructive sensing of seafood freshness",https://www.scopus.com/authid/detail.uri?authorId=8914725100&amp,Choi S.S.,Nature Publishing Group,"Lee Kyung-mi, Son Manki, Kang Ju-hee, Kim Daesan, Hong Seunghun, Park Taihyun, Chun Hyang-sook, Choi Shin-sik",547,Article,Scientific ReportsOpen Access
50,Mechanical response of common millet (Panicum miliaceum) seeds under quasi-static compression: Experiments and modeling,https://www.scopus.com/authid/detail.uri?authorId=24559236200&amp,Song J.,Elsevier Ltd,"Hasseldine Benjamin P.J., Gao Chao, Collins Joseph M., Jung Hyun-do, Jang Taesik, Song Juha, Li Yaning",102-113,Article,Journal of the Mechanical Behavior of Biomedical Materials
51,A crack-free anti-corrosive coating strategy for magnesium implants under deformation,https://www.scopus.com/authid/detail.uri?authorId=24475968400&amp,Li Y.,Elsevier Ltd,"Cheon Kwang-hee, Gao Chao, Kang Minho, Jung Hyun-do, Jang Taesik, Kim Hyounee, Li Yaning, Song Juha",116-124,Article,Corrosion Science
52,Incorporation of Calcium Sulfate Dihydrate into Hydroxyapatite Microspheres to Improve the Release of Bone Morphogenetic Protein-2 and Accelerate Bone Regeneration,https://www.scopus.com/authid/detail.uri?authorId=55575392600&amp,Jung H.-D.,American Chemical Society,"Baek Jaeuk, Lee Hyun, Jang Taesik, Song Juha, Kim Hyounee, Jung Hyun-do",846-856,Article,ACS Biomaterials Science and Engineering
53,Enhanced mechanical stability of PTFE coating on nano-roughened NiTi for biomedical applications,https://www.scopus.com/authid/detail.uri?authorId=57188754395&amp,Jeong S.-H.,Elsevier B.V.,"Lee Min-kyu, Park Cheonil, Jang Taesik, Kim Hyounee, Jeong Seol-ha",12-15,Article,Materials Letters
54,Effect of HF/HNO3-treatment on the porous structure and cell penetrability of titanium (Ti) scaffold,https://www.scopus.com/authid/detail.uri?authorId=36546069900&amp,Jang T.-S.,Elsevier Ltd,"Lee Hyun, Jung Hyun-do, Kang Minho, Song Juha, Kim Hyounee, Jang Taesik",65-73,Article,Materials and DesignOpen Access
55,Zirconia-Polyurethane Aneurysm Clip,https://www.scopus.com/authid/detail.uri?authorId=7410121349&amp,Kim J.E.,Elsevier Inc.,"Cho Wongsang, Cho Kyeong-il, Kim Jeong Eun, Jang Taesik, Ha Eun-jin, Kang Hyun-seung, Son Young-je, Choi Seunghong, Lee Seunghyun, Kim Chong-chan, Sun Jeongyun, Kim Hyounee",14-23,Article,World Neurosurgery
56,Antibacterial and bioactive properties of stabilized silver on titanium with a nanostructured surface for dental applications,https://www.scopus.com/authid/detail.uri?authorId=36546069900&amp,Jang T.-S.,Elsevier B.V.,"Kim Sungwon, Park Cheonil, Cheon Kwang-hee, Jung Hyun-do, Song Juha, Kim Hyounee, Jang Taesik",232-240,Article,Applied Surface Science
57,Strong and biocompatible poly(lactic acid) membrane enhanced by Ti3C2Tz (MXene) nanosheets for Guided bone regeneration,https://www.scopus.com/authid/detail.uri?authorId=28067917400&amp,Kim H.-E.,Elsevier B.V.,"Chen Ke, Chen Youhu, Deng Qihuang, Jeong Seol-ha, Jang Taesik, Du Shiyu, Kim Hyounee, Huang Qing, Han Cheol-Min",114-117,Article,Materials Letters
58,Facile strategy involving low-temperature chemical cross-linking to enhance the physical and biological properties of hyaluronic acid hydrogel,https://www.scopus.com/authid/detail.uri?authorId=36546069900&amp,Jang T.-S.,Elsevier Ltd,"Baek Jaeuk, Fan Yingfang, Jeong Seol-ha, Lee Ho-yong, Jung Hyun-do, Kim Hyounee, Kim Sukwha, Jang Taesik",545-553,Article,Carbohydrate Polymers
59,Biomimetic porous Mg with tunable mechanical properties and biodegradation rates for bone regeneration,https://www.scopus.com/authid/detail.uri?authorId=55575392600&amp,Jung H.-D.,Acta Materialia Inc,"Kang Minho, Lee Hyun, Jang Taesik, Seong Yun-jeong, Kim Hyounee, Koh Younghag, Song Juha, Jung Hyun-do",453-467,Article,Acta Biomaterialia
60,"Plant seed-inspired cell protection, dormancy, and growth for large-scale biofabrication",https://www.scopus.com/authid/detail.uri?authorId=24475968400&amp,Copyright 2019 Elsevier B.V. All rights reserved.,Institute of Physics Publishing,"Pan Houwen Matthew, Chen Shengyang, Jang Taesik, Han Win Tun, Jung Hyun-do, Li Yaning, Song Juha",25008,Article,Biofabrication
61,Enhanced Osseointegration Ability of Poly(lactic acid) via Tantalum Sputtering-Based Plasma Immersion Ion Implantation,https://www.scopus.com/authid/detail.uri?authorId=36546069900&amp,Jang T.-S.,American Chemical Society,"Park Cheonil, Seong Yun-jeong, Kang Ingu, Song Eun-ho, Lee Hyun, Kim Jinyoung, Jung Hyun-do, Kim Hyounee, Jang Taesik",10492-10504,Article,ACS Applied Materials and Interfaces
62,Extremely Versatile Deformability beyond Materiality: A New Material Platform through Simple Cutting for Rugged Batteries,https://www.scopus.com/authid/detail.uri?authorId=36774189400&amp,Song J.,Wiley-VCH Verlag,"Kim Kee-bum, Lee Youngjoo, Costa Avelino, Lee Yuki, Jang Taesik, Lee Myounggyu, Joo Youngchang, Oh Kyu-hwan, Song Juha, Choi In Suk",1900206,Article,Advanced Engineering Materials
63,In-vitro blood and vascular compatibility of sirolimus-eluting organic/inorganic hybrid stent coatings,https://www.scopus.com/authid/detail.uri?authorId=55575392600&amp,Jung H.-D.,Elsevier B.V.,"Jang Taesik, Cheon Kwang-hee, Ahn Ji-ho, Song Eun-ho, Kim Hyounee, Jung Hyun-do",405-413,Article,Colloids and Surfaces B: Biointerfaces
64,Reduced fibrous capsule formation at nano-engineered silicone surfaces: Via tantalum ion implantation,https://www.scopus.com/authid/detail.uri?authorId=36546069900&amp,Kim S.,Royal Society of Chemistry,"Park Cheonil, Lee Si-woo, Kim Jinyoung, Song Eun-ho, Jung Hyun-do, Park Ji-ung, Kim Hyounee, Kim Sukwha, Jang Taesik",2907-2919,Article,Biomaterials Science
65,"Fabrication of strong, bioactive vascular grafts with PCL/collagen and PCL/silica bilayers for small-diameter vascular applications",https://www.scopus.com/authid/detail.uri?authorId=36546069900&amp,Jang T.-S.,Elsevier Ltd,"Park Suhyung, Kim Jinyoung, Lee Minkyu, Park Cheonil, Jung Hyun-do, Kim Hyounee, Jang Taesik",108079,Article,Materials and DesignOpen Access
66,Enhanced bioactivity of titanium-coated polyetheretherketone implants created by a high-temperature 3D printing process,https://www.scopus.com/authid/detail.uri?authorId=7501828399&amp,Copyright 2019 Elsevier B.V. All rights reserved.,Institute of Physics Publishing,"Jung Hyun-do, Jang Taesik, Lee Ji-eun, Park Seong-je, Son Yong, Park Sukhee",45014,Article,Biofabrication
67,Ta ion implanted nanoridge-platform for enhanced vascular responses,https://www.scopus.com/authid/detail.uri?authorId=55575392600&amp,Jung H.-D.,Elsevier Ltd,"Jang Taesik, Lee Jae-hwan, Kim Sungwon, Park Cheonil, Song Juha, Jae Hwanjun, Kim Hyounee, Chung Jin Wook, Jung Hyun-do",119461,Article,Biomaterials
68,Fabrication of poly(lactic acid)/Ti composite scaffolds with enhanced mechanical properties and biocompatibility via fused filament fabrication (FFF)–based 3D printing,https://www.scopus.com/authid/detail.uri?authorId=55575392600&amp,Jung H.-D.,Elsevier B.V.,"Lee Jina, Lee Hyun, Cheon Kwang-hee, Park Cheonil, Jang Taesik, Kim Hyounee, Jung Hyun-do",100883,Article,Additive Manufacturing
69,Improved cell viability for large-scale biofabrication with photo-crosslinkable hydrogel systems through a dual-photoinitiator approach,https://www.scopus.com/authid/detail.uri?authorId=24475968400&amp,Song J.,Royal Society of Chemistry,"Han Win Tun, Jang Taesik, Chen Shengyang, Chong Lydia Shi Hui, Jung Hyun-do, Song Juha",450-461,Article,Biomaterials Science
70,Enhanced endothelial cell activity induced by incorporation of nano-thick tantalum layer in artificial vascular grafts,https://www.scopus.com/authid/detail.uri?authorId=36546069900&amp,Kim H.-E.,Elsevier B.V.,"Park Cheonil, Park Suhyung, Kim Jinyoung, Han Ahram, Ahn Sanghyun, Min Seungkee, Jae Hwanjun, Chung Jin Wook, Lee Jongho, Jung Hyun-do, Kim Hyounee, Jang Taesik",144801,Article,Applied Surface Science
71,3D freeform printing of nanocomposite hydrogels through in situ precipitation in reactive Viscous fluid,https://www.scopus.com/authid/detail.uri?authorId=24475968400&amp,Song J.,Whioce Publishing Pte. Ltd.,"Chen Shengyang, Jang Taesik, Pan Houwen Matthew, Jung Hyun-do, Sia Mingwei, Xie Shuying, Hang Yao, Chong Seow Khoon Mark, Wang Dongan, Song Juha",1-21,Article,International Journal of BioprintingOpen Access
72,Machine Learning Enabled Tailor-Made Design of Application-Specific Metal-Organic Frameworks,https://www.scopus.com/authid/detail.uri?authorId=57189850196&amp,Lee Y.,American Chemical Society,"Zhang Xiangyu, Zhang Kexin, Lee Yongjin",734-743,Article,ACS Applied Materials and Interfaces
73,High-Throughput Screening Approach for Nanoporous Materials Genome Using Topological Data Analysis: Application to Zeolites,https://www.scopus.com/authid/detail.uri?authorId=7102999528&amp,Lee Y.,American Chemical Society,"Lee Yongjin, Barthel Senja D., Dłotko Paweł, Moosavi Seyed Mohamad, Hess Kathryn P., Smit Berend",4427-4437,Article,Journal of Chemical Theory and Computation
74,Tuning Metal-Organic Framework Nanocrystal Shape through Facet-Dependent Coordination,https://www.scopus.com/authid/detail.uri?authorId=6602491091&amp,Chou L.-Y.,American Chemical Society,"Liu Xiaoyuan, Lo Wei Shang, Wu Chunhui, Williams Benjamin P., Luo Lianshun, Li Yang, Chou Lienyang, Lee Yongjin, Tsung Chiakuang",1774-1780,Article,Nano Letters
75,A computational study to design zeolite-templated carbon materials with high performance for CO2/N2 separation,https://www.scopus.com/authid/detail.uri?authorId=57189850196&amp,Lee Y.,Elsevier B.V.,"Cui Jing, Zhang Kexin, Zhang Xiangyu, Lee Yongjin",109947,Article,Microporous and Mesoporous Materials
76,General way to construct micro- And mesoporous metal–organic framework-based porous liquids,https://www.scopus.com/authid/detail.uri?authorId=57003828500&amp,Lee Y.,American Chemical Society,"He Sanfeng, Chen Lihan, Cui Jing, Yuan Biao, Wang Hongliang, Wang Fang, Yu Yi, Lee Yongjin, Li Tao",19708-19714,Article,Journal of the American Chemical Society
77,Machine Learning Prediction on Properties of Nanoporous Materials Utilizing Pore Geometry Barcodes,https://www.scopus.com/authid/detail.uri?authorId=57189850196&amp,Lee Y.,American Chemical Society,"Zhang Xiangyu, Cui Jing, Zhang Kexin, Wu Jiasheng, Lee Yongjin",4636-4644,Article,Journal of Chemical Information and Modeling
78,0,0,0,0,0,0,0,
79,Strong thermal conductivity dependence on arsenic-vacancy complex formation in arsenic-doped silicon,https://www.scopus.com/authid/detail.uri?authorId=7202677646&amp,Hwang G.S.,American Institute of Physics Inc.,"Lee Yongjin, Hwang Gyeong S.",195104,Article,Journal of Applied Physics
80,Generating carbon schwarzites via zeolite-templating,https://www.scopus.com/authid/detail.uri?authorId=7102999528&amp,Smit B.,National Academy of Sciences,"Braun Efrem, Lee Yongjin, Moosavi Seyed Mohamad, Barthel Senja D., Mercado Rocío, Baburin Igor A., Proserpio Davide M., Smit Berend",E8116-E8124,Article,Proceedings of the National Academy of Sciences of the United States of America
81,Molecular dynamics investigation of the thermal conductivity of ternary silicon-germanium-tin alloys,https://www.scopus.com/authid/detail.uri?authorId=7202677646&amp,Hwang G.S.,Institute of Physics Publishing,"Lee Yongjin, Hwang Gyeong S.",494001,Article,Journal of Physics D: Applied Physics
